{
    "device_name" : "FM2",
    "device_slots" : [1],
    "init" : [["unmute osc", "/param/a/mixer/osc2/mute", 0.0 ], ["set osc type", "/param/a/osc/2/type", 6.0 ]],
    "osc": {
        "section": "FM2",
        "controls": [
            ["PITCH", "/param/a/osc/2/pitch", 0.0, 1.0],
            ["M1 AMOUNT", "/param/a/osc/2/param1", 0.0, 1.0],
            ["M1 RATIO", "/param/a/osc/2/param2", 0.0, 32.0],
            ["M2 AMOUNT", "/param/a/osc/2/param3", 0.0, 1.0],
            ["M2 RATIO", "/param/a/osc/2/param4", 0.0 , 32.0],
            ["M1/2 OFFSET", "/param/a/osc/2/param5", 0.0 , 1.0],
            ["M1/2 PHASE", "/param/a/osc/2/param6", 0.0, 1.0],
            ["FEEDBACK", "/param/a/osc/2/param7", 0.0, 1.0],
            [],
            [],
            ["KEYTRACK", "/param/a/osc/2/keytrack", 0.0, 1.0],
            ["RETRIG", "/param/a/osc/2/retrigger", 0.0, 1.0],
            ["FIL ROUTE", "/param/a/mixer/osc2/route", 0.0 , 2.0],
            [],
            ["FM DEPTH", "/param/a/osc/fm_depth", 0.0, 1.0],
            ["FM ROUTING", "/param/a/osc/fm_routing", 0.0, 3.0]
          ]
      }

}